{
  "schema_version": "1.1.0",
  "document": {
    "id": "kant-looper-routing-ssot",
    "title": "Kant Looper Multimodel Routing SSOT",
    "status": "active",
    "effective_date": "2026-07-16",
    "last_verified_at": "2026-07-16",
    "owner": "Kant Looper maintainers",
    "approval_required": true,
    "source_of_truth": true,
    "generated_docs": [
      "references/multimodel-coding-agent-routing-guide.md",
      "references/multimodel-coding-agent-routing-guide-simplified.md"
    ]
  },
  "governance": {
    "principles": [
      "provider_independence",
      "human_final_control",
      "least_privilege",
      "evidence_before_success",
      "cross_provider_review",
      "reproducible_routing"
    ],
    "normative_language": "RFC2119",
    "change_control": {
      "direct_edit_to_generated_docs": "forbidden",
      "ssot_change_requires": [
        "schema_validation",
        "semantic_validation",
        "source_verification",
        "regression_evaluation",
        "human_approval"
      ],
      "emergency_disable_without_benchmark": true,
      "emergency_enable_without_benchmark": false
    }
  },
  "agent_bindings": {
    "codex": {
      "display_name": "Codex CLI",
      "allowed_model_patterns": [
        "^gpt-"
      ]
    },
    "opencode": {
      "display_name": "OpenCode",
      "allowed_model_patterns": [
        "^glm-",
        "^MiniMax-"
      ]
    },
    "grok": {
      "display_name": "Grok CLI",
      "allowed_model_patterns": [
        "^grok-"
      ]
    },
    "agy": {
      "display_name": "Antigravity (agy)",
      "allowed_model_patterns": [
        "^gemini-"
      ]
    },
    "claude": {
      "display_name": "Claude CLI",
      "denied_model_patterns": [
        "^MiniMax-"
      ]
    }
  },
  "providers": {
    "openai": {
      "display_name": "OpenAI",
      "official_sources": [
        "https://platform.openai.com/docs/models",
        "https://openai.com/index/gpt-5-6/"
      ]
    },
    "zai": {
      "display_name": "Z.AI",
      "official_sources": [
        "https://docs.z.ai/",
        "https://docs.z.ai/release-notes/new-released"
      ]
    },
    "xai": {
      "display_name": "xAI",
      "official_sources": [
        "https://docs.x.ai/docs/models",
        "https://x.ai/news"
      ]
    },
    "google": {
      "display_name": "Google",
      "official_sources": [
        "https://ai.google.dev/gemini-api/docs/models",
        "https://ai.google.dev/gemini-api/docs/changelog",
        "https://ai.google.dev/gemini-api/docs/deprecations"
      ]
    },
    "minimax": {
      "display_name": "MiniMax",
      "official_sources": [
        "https://platform.minimax.io/docs/guides/models-intro",
        "https://www.minimax.io/blog"
      ]
    },
    "anthropic": {
      "display_name": "Anthropic",
      "official_sources": [
        "https://www.anthropic.com/claude",
        "https://docs.anthropic.com/claude/docs"
      ]
    }
  },
  "models": {
    "openai/gpt-5.6-sol": {
      "provider": "openai",
      "model_id": "gpt-5.6-sol",
      "agent_tool": "codex",
      "status": "stable",
      "tier": "premium",
      "capabilities": [
        "coding",
        "computer_use",
        "long_horizon",
        "long_tool_chain",
        "multimodal",
        "security",
        "tool_use"
      ],
      "context_tokens": 1050000,
      "recommended_tiers": [
        "T3",
        "T4"
      ],
      "verified_at": "2026-07-16",
      "sources": [
        "https://platform.openai.com/docs/models",
        "https://openai.com/index/gpt-5-6/"
      ]
    },
    "openai/gpt-5.6-terra": {
      "provider": "openai",
      "model_id": "gpt-5.6-terra",
      "agent_tool": "codex",
      "status": "stable",
      "tier": "standard",
      "capabilities": [
        "coding",
        "tool_use",
        "general_coding"
      ],
      "context_tokens": 1050000,
      "recommended_tiers": [
        "T1",
        "T2"
      ],
      "verified_at": "2026-07-16",
      "sources": [
        "https://platform.openai.com/docs/models",
        "https://openai.com/index/gpt-5-6/"
      ]
    },
    "openai/gpt-5.6-luna": {
      "provider": "openai",
      "model_id": "gpt-5.6-luna",
      "agent_tool": "codex",
      "status": "stable",
      "tier": "economy",
      "capabilities": [
        "coding",
        "fast",
        "batch",
        "structured"
      ],
      "context_tokens": 1050000,
      "recommended_tiers": [
        "T0",
        "T1"
      ],
      "verified_at": "2026-07-16",
      "sources": [
        "https://platform.openai.com/docs/models",
        "https://openai.com/index/gpt-5-6/"
      ]
    },
    "zai/glm-5.2": {
      "provider": "zai",
      "model_id": "glm-5.2",
      "agent_tool": "opencode",
      "status": "stable",
      "tier": "premium",
      "capabilities": [
        "coding",
        "tool_use",
        "long_horizon",
        "huge_context"
      ],
      "context_tokens": 1000000,
      "recommended_tiers": [
        "T2",
        "T3",
        "T4"
      ],
      "verified_at": "2026-07-16",
      "sources": [
        "https://docs.z.ai/guides/llm/glm-5.2"
      ]
    },
    "zai/glm-5-turbo": {
      "provider": "zai",
      "model_id": "glm-5-turbo",
      "agent_tool": "opencode",
      "status": "proposed",
      "tier": "specialized",
      "capabilities": [
        "coding",
        "tool_use",
        "long_tool_chain"
      ],
      "context_tokens": null,
      "recommended_tiers": [
        "T2",
        "T3"
      ],
      "verified_at": "2026-07-16",
      "sources": [
        "https://docs.z.ai/guides/llm/glm-5-turbo"
      ]
    },
    "zai/glm-4.7": {
      "provider": "zai",
      "model_id": "glm-4.7",
      "agent_tool": "opencode",
      "status": "stable",
      "tier": "standard",
      "capabilities": [
        "coding",
        "tool_use",
        "general_coding"
      ],
      "context_tokens": 200000,
      "recommended_tiers": [
        "T1",
        "T2"
      ],
      "verified_at": "2026-07-16",
      "sources": [
        "https://docs.z.ai/guides/llm/glm-4.7"
      ]
    },
    "zai/glm-4.7-flash": {
      "provider": "zai",
      "model_id": "glm-4.7-flash",
      "agent_tool": "opencode",
      "status": "proposed",
      "tier": "economy",
      "capabilities": [
        "coding",
        "fast",
        "batch"
      ],
      "context_tokens": 200000,
      "recommended_tiers": [
        "T0",
        "T1"
      ],
      "verified_at": "2026-07-16",
      "sources": [
        "https://docs.z.ai/guides/llm/glm-4.7"
      ]
    },
    "zai/glm-5v-turbo": {
      "provider": "zai",
      "model_id": "glm-5v-turbo",
      "agent_tool": "opencode",
      "status": "proposed",
      "tier": "standard",
      "capabilities": [
        "coding",
        "vision",
        "multimodal",
        "tool_use"
      ],
      "context_tokens": null,
      "recommended_tiers": [
        "T1",
        "T2"
      ],
      "verified_at": "2026-07-16",
      "sources": [
        "https://docs.z.ai/"
      ]
    },
    "xai/grok-4.5": {
      "provider": "xai",
      "model_id": "grok-4.5",
      "agent_tool": "grok",
      "status": "stable",
      "tier": "standard",
      "capabilities": [
        "coding",
        "tool_use",
        "terminal",
        "systems",
        "fast"
      ],
      "context_tokens": 500000,
      "recommended_tiers": [
        "T1",
        "T2",
        "T3"
      ],
      "verified_at": "2026-07-16",
      "sources": [
        "https://docs.x.ai/docs/models",
        "https://x.ai/news/grok-4-5"
      ]
    },
    "google/gemini-3.5-flash": {
      "provider": "google",
      "model_id": "gemini-3.5-flash",
      "agent_tool": "agy",
      "status": "stable",
      "tier": "standard",
      "capabilities": [
        "coding",
        "tool_use",
        "multimodal",
        "agentic",
        "fast"
      ],
      "context_tokens": null,
      "recommended_tiers": [
        "T1",
        "T2"
      ],
      "verified_at": "2026-07-16",
      "sources": [
        "https://ai.google.dev/gemini-api/docs/models"
      ]
    },
    "google/gemini-3.1-pro-preview": {
      "provider": "google",
      "model_id": "gemini-3.1-pro-preview",
      "agent_tool": "agy",
      "status": "preview",
      "tier": "premium",
      "capabilities": [
        "coding",
        "tool_use",
        "multimodal",
        "reasoning"
      ],
      "context_tokens": null,
      "recommended_tiers": [
        "T3"
      ],
      "verified_at": "2026-07-16",
      "sources": [
        "https://ai.google.dev/gemini-api/docs/models"
      ]
    },
    "google/gemini-3.1-flash-lite": {
      "provider": "google",
      "model_id": "gemini-3.1-flash-lite",
      "agent_tool": "agy",
      "status": "stable",
      "tier": "economy",
      "capabilities": [
        "fast",
        "batch",
        "structured"
      ],
      "context_tokens": null,
      "recommended_tiers": [
        "T0",
        "T1"
      ],
      "verified_at": "2026-07-16",
      "sources": [
        "https://ai.google.dev/gemini-api/docs/models"
      ]
    },
    "minimax/MiniMax-M3": {
      "provider": "minimax",
      "model_id": "MiniMax-M3",
      "agent_tool": "opencode",
      "status": "stable",
      "tier": "premium",
      "capabilities": [
        "coding",
        "huge_context",
        "long_horizon",
        "long_tool_chain",
        "multimodal",
        "tool_use"
      ],
      "context_tokens": 1000000,
      "recommended_tiers": [
        "T2",
        "T3",
        "T4"
      ],
      "verified_at": "2026-07-16",
      "sources": [
        "https://platform.minimax.io/docs/guides/models-intro",
        "https://www.minimax.io/blog/minimax-m3"
      ]
    },
    "minimax/MiniMax-M2.7": {
      "provider": "minimax",
      "model_id": "MiniMax-M2.7",
      "agent_tool": "opencode",
      "status": "stable",
      "tier": "standard",
      "capabilities": [
        "coding",
        "tool_use",